{
  "检查对象": "半导体设备国产替代通用框架样例",
  "通过结论": "部分通过",
  "可信度边界": {
    "最高可标记等级": "单来源候选",
    "材料来源数量": 1,
    "历史样本数量": 0,
    "不得越级说明": "当前只有单篇材料且无历史样本，不能标记为多来源候选或历史支持模板候选。"
  },
  "检查项": [
    {
      "名称": "来源完整",
      "结果": "通过",
      "严重程度": "中",
      "说明": "样例提供了文档标题、发布时间和证据位置。"
    },
    {
      "名称": "历史依据",
      "结果": "不通过",
      "严重程度": "高",
      "说明": "未提供历史兑现或失效样本。"
    },
    {
      "名称": "模板谨慎",
      "结果": "通过",
      "严重程度": "高",
      "说明": "样例已将核心逻辑标记为单来源候选或需补历史样本。"
    }
  ],
  "问题清单": [
    "缺少多来源材料。",
    "缺少历史样本，不能形成相对可信模板。"
  ],
  "修正建议": [
    "补充至少两个独立来源的订单与收入确认材料。",
    "补充历史上订单高增后收入确认兑现或失效的案例。"
  ],
  "是否可展示": true,
  "是否可沉淀": false,
  "是否需要专家校准": true
}
